"Mã nhà cung cấp","Tên nhà cung cấp","Địa chỉ","Email","Số điện thoại","Mã số thuế","Ngày tạo"
"NCC001","Công ty TNHH ABC","123 Đường ABC, Quận XYZ, Thành phố HCM","abc@company.com","abc@company.com","0123456789","ABC123456","2023-01-01 08:00:00"
"NCC002","Công ty XYZ Ltd","456 Đường XYZ, Quận ABC, Thành phố Hà Nội","xyz@company.com","xyz@company.com","0987654321","0485186538","2023-01-02 09:00:00"
"NCC003","Công ty MNO","789 Đường MNO, Quận DEF, Thành phố Đà Nẵng","mno@company.com","mno@company.com","0369852147","MNO456789","2023-01-03 10:00:00"
"NCC004","Công ty PQR","101 Đường PQR, Quận GHI, Thành phố Cần Thơ","pqr@company.com","pqr@company.com","0246857319","PQR987654","2023-01-04 11:00:00"
"NCC005","Công ty STU","111 Đường STU, Quận KLM, Thành phố Hải Phòng","stu@company.com","stu@company.com","0379514682","STU123456","2023-01-05 12:00:00"
"NCC06","Nhà cung cấp công cụ sữa chữa oto Bình Lâm","Dĩ An, Bình Dương","binhlamoto@gmail.com","binhlamoto@gmail.com","0165164866","065464891","2024-04-20 16:52:12"
